Title,Price,Tags,Description,Image URL,Source URL
Beautiful Ganesh Lakshmi Brass Idol Pair,"₹ 2,500","Tags: ganesha, Goddess Laxmi, lakshmi, Lord Ganesha","Elevate your home with the divine presence of Lord Ganesh and Goddess Lakshmi, embodied in the “Beautiful Ganesh Lakshmi Brass Idol Pair.” This exquisite pair of brass idols, with a combined weight of 2 kg, is a harmonious blend of artistry and spirituality, perfect for enhancing your sacred space or as a cherished gift. Key Features: Symbol of Prosperity: Lord Ganesh, the remover of obstacles, and Goddess Lakshmi, the bestower of wealth and prosperity, come together in this pair to bless your life with abundance and blessings. Exquisite Craftsmanship: Each idol in this pair is a masterpiece of craftsmanship. The intricate details, from Lord Ganesh’s elephant head to Goddess Lakshmi’s graceful pose, capture the essence of divinity and beauty. Perfect Pair: The inclusion of both Lord Ganesh and Goddess Lakshmi ensures a balanced and harmonious representation of two significant deities in Hinduism. Their combined presence is believed to bring blessings, success, and harmony to your home. Ideal Size and Weight: Standing at the ideal size and weighing 2 kg as a pair, these idols are substantial enough to make a statement on your altar, in your living room, or any space you wish to infuse with spirituality and grace. Versatile Placement: The timeless design of these brass idols seamlessly complements various decor styles. Whether placed in your home, office, or temple, they radiate an aura of peace, prosperity, and devotion. Enrich your life with the blessings of Lord Ganesh and Goddess Lakshmi by welcoming the “Beautiful Ganesh Lakshmi Brass Idol Pair” into your space. As you invite this divine duo, may they usher in prosperity, remove obstacles, and fill your surroundings with love and abundance.",https://i0.wp.com/theartofbrass.com/wp-content/uploads/2023/09/TAOB-34.jpg?fit=416%2C589&ssl=1,https://theartofbrass.com/product/beautiful-ganesh-lakshmi-brass-idol-pair/
Beautifully Carved Antique Lakshmi Ganesh Murti Set Brass Idol,"₹ 7,300","Tags: ganesha, Goddess Laxmi, lakshmi, Lord Ganesh","Elevate your sacred space with the profound grace and blessings of Lord Ganesh and Goddess Lakshmi, embodied in the “Beautifully Carved Antique Lakshmi Ganesh Murti Set Brass Idol.” This exquisite pair of antique brass idols, with a combined weight of 5 kg and each idol standing at approximately 8 inches in height, is a testament to artistry and spirituality, perfect for enhancing your home altar, temple, or as a cherished gift. Key Features: Antique Elegance: Crafted with intricate detailing, these brass idols exude timeless charm. Their antique finish adds an aura of classical elegance to your spiritual environment. Divine Pair: This set includes both Lord Ganesh and Goddess Lakshmi, symbolizing the remover of obstacles and the bestower of wealth and prosperity. Their combined presence is believed to bring blessings, success, and abundance to your home. Expert Craftsmanship: Every aspect of these idols reflects the craftsmanship and devotion that went into their creation. From Lord Ganesh’s divine attributes to Goddess Lakshmi’s serene grace, each detail is an embodiment of artistry and faith. Perfect Size and Weight: Standing at approximately 8 inches in height and with a combined weight of 5 kg, these idols hold a prominent and stable place in your sacred space, serving as a focal point for your prayers and devotion. Spiritual Significance: Whether you are a dedicated devotee seeking blessings or simply appreciate the symbolism of prosperity and wisdom, these idols inspire profound reverence and reflection. Versatile Display: The classic design of these brass idols complements various decor styles. They can grace your living space, office, or temple, creating an atmosphere of divine presence and abundance. Embrace the timeless beauty and spiritual significance of the “Beautifully Carved Antique Lakshmi Ganesh Murti Set Brass Idol.” As you welcome these sacred representations into your life, may they fill your surroundings with blessings, prosperity, and enduring grace.",https://i0.wp.com/theartofbrass.com/wp-content/uploads/2023/09/TAOB-37.jpg?fit=416%2C589&ssl=1,https://theartofbrass.com/product/beautifully-carved-antique-lakshmi-ganesh-murti-set-brass-idol/
Brass Box with Copper-Colored Finish: Cylindrical Shape with Lid – 2 kg,"₹ 2,500","Tags: Brass Box, Copper Brass Box","Elevate your home decor with this exquisite brass box, weighing 2 kilograms and standing at a height of 13 inches. This cylindrical-shaped box boasts a stunning copper-colored finish that adds a touch of elegance to any space. Its intricate craftsmanship and timeless design make it not just a functional storage solution but also a captivating decorative piece. The lid of the brass box fits snugly, ensuring that your precious items or trinkets are kept safe and secure. Whether used to store jewelry, keepsakes, or as a standalone decor item, this brass box combines form and function seamlessly. Its rich color and fine detailing make it a conversation piece and a valuable addition to your home decor collection.",https://i0.wp.com/theartofbrass.com/wp-content/uploads/2023/09/TAOB-49.jpg?fit=416%2C589&ssl=1,https://theartofbrass.com/product/brass-box-with-copper-colored-finish-cylindrical-shape-with-lid-2-kg/
Brass Box with Copper-Colored Finish: Cylindrical Shape with Lid – 2.5 kg,"₹ 3,125","Tags: Brass Box, Copper Brass Box","Elevate your home decor with this exquisite brass box, weighing 2 kilograms and standing at a height of 13 inches. This cylindrical-shaped box boasts a stunning copper-colored finish that adds a touch of elegance to any space. Its intricate craftsmanship and timeless design make it not just a functional storage solution but also a captivating decorative piece. The lid of the brass box fits snugly, ensuring that your precious items or trinkets are kept safe and secure. Whether used to store jewelry, keepsakes, or as a standalone decor item, this brass box combines form and function seamlessly. Its rich color and fine detailing make it a conversation piece and a valuable addition to your home decor collection.",https://i0.wp.com/theartofbrass.com/wp-content/uploads/2023/09/TAOB-50.jpg?fit=416%2C589&ssl=1,https://theartofbrass.com/product/brass-box-with-copper-colored-finish-cylindrical-shape-with-lid-2-5-kg/
Brass Decor Elephant with Exquisite Engravings – 1.5 kg,"₹ 1,999","Tags: elephant, Gajraj, Hathi","Elevate your home decor with this stunning brass elephant weighing 1.5 kilograms. This magnificent piece showcases intricate and beautiful engravings that add a touch of elegance and charm to any space. Crafted with precision and attention to detail, this brass decor elephant is more than just an ornament; it’s a work of art that enhances the aesthetics of your living space. Whether you place it on a shelf, mantel, or as a centerpiece, it exudes a timeless and regal appeal that captures the essence of traditional craftsmanship.",https://i0.wp.com/theartofbrass.com/wp-content/uploads/2023/09/TAOB-48.jpg?fit=416%2C589&ssl=1,https://theartofbrass.com/product/brass-decor-elephant-with-exquisite-engravings-1-5-kg/
Brass Ghanshayam Idol: Radiant Lord Krishna,₹ 500,"Tags: Ghanshyam, Lord Krishna","Embrace the divine aura with this exquisite brass Ghanshayam idol, weighing 400 grams and standing at a height of 5 inches. Crafted with precision and adorned with intricate details, this idol captures the timeless grace and charm of Lord Krishna in his youthful form. The brass Ghanshayam idol serves as a symbol of love, devotion, and spirituality. Whether displayed in your home altar or given as a meaningful gift, it radiates a sense of serenity and blessings, inviting the divine presence of Lord Krishna into your life. This idol is a cherished addition to your sacred space and a testament to the finest craftsmanship in brass artistry.",https://i0.wp.com/theartofbrass.com/wp-content/uploads/2023/09/TAOB-51.jpg?fit=416%2C589&ssl=1,https://theartofbrass.com/product/brass-ghanshayam-idol-radiant-lord-krishna/
Brass Idol: Goddess Umiya in Divine Form,₹ 750,"Tags: Umiya, Umiya Maa","Behold the exquisite brass idol of Goddess Umiya, weighing 600 grams and standing at a height of 5 inches. This finely crafted representation captures the divine essence of Goddess Umiya as she sits gracefully in all her glory. With intricate detailing and a radiant aura, this brass idol is a symbol of beauty and spirituality. Whether you seek a sacred addition to your home altar or a thoughtful gift, this idol is a testament to craftsmanship and devotion, inviting the blessings and grace of Goddess Umiya into your life. Umiya Mata is the deity worshipped by lakhs of Kadva Patidars spread across the world. She is the consort of the Mighty Shivashankar and the daughter of Parvatraj Dakhsa. She is the supreme power ‘Shakti’ and is also the mother of the Ganesha. The word Umiya is derived from the word Uma, meaning mother. She sits in the main temple of Unjha and is worshipped by her sons and daughters across Gujarat and World. She is worshipped in various forms, the most popular form is of “Parvati” and she is also known as Nav Chandi or Nav Durga due to the nine forms popularly worshipped.",https://i0.wp.com/theartofbrass.com/wp-content/uploads/2023/09/TAOB-47.jpg?fit=416%2C593&ssl=1,https://theartofbrass.com/product/brass-idol-goddess-umiya-in-divine-form/
Brass Peacock Diya Lamp Stand,"₹ 6,500","Tags: Deepak, Diya, Lamp Stand","Illuminate your living space with the timeless beauty and elegance of the “Brass Peacock Diya Lamp Stand.” This exquisite lamp stand, weighing a substantial 5 kg and standing at an impressive 18 inches in height, combines artistry and functionality in a single piece. Key Features: Peacock Inspiration: Crafted with intricate detailing, this lamp stand features a peacock design that is not only visually captivating but also symbolizes grace, beauty, and spirituality. Functional Art: The lamp stand is not just a work of art but also a practical addition to your home decor. It accommodates diya (oil lamps) that can be lit during special occasions, religious ceremonies, or to create a warm and inviting ambiance in your living space. Solid Brass Construction: Made from high-quality brass, this lamp stand boasts durability, longevity, and resistance to corrosion. It’s a statement piece that will last for generations. Perfect Weight and Size: With a weight of 5 kg and an imposing height of 18 inches, this lamp stand is designed for stability and prominence. It commands attention and serves as a centerpiece for your decor. Versatile Placement: Whether you display it in your living room, entrance foyer, temple room, or any other area, this lamp stand infuses an atmosphere of spirituality and elegance into your surroundings. The “Brass Peacock Diya Lamp Stand” is a fusion of art and tradition, a reflection of your appreciation for both beauty and functionality. As it graces your living space, it not only captivates with its aesthetics but also lights up your moments with the warm glow of tradition and culture.",https://i0.wp.com/theartofbrass.com/wp-content/uploads/2023/09/TAOB-39.jpg?fit=416%2C589&ssl=1,https://theartofbrass.com/product/brass-peacock-diya-lamp-stand/
Brass Shankh with Vishnu Imprint and Divine Sound,"₹ 1,375","Tags: Conch, Shankh","Experience the transcendental synergy of spirituality and sound with our “Brass Shankh with Vishnu Imprint and Divine Sound.” This meticulously crafted brass Shankh bears the sacred Vishnu imprint and, when blown, produces a divine and resonant sound that connects you to the divine realm. Key Features: Vishnu Imprint: This Shankh proudly displays an intricately detailed Vishnu imprint, honoring Lord Vishnu, the preserver and protector in Hinduism. The presence of Vishnu’s divine form serves as a constant source of inspiration and devotion. Artistic Craftsmanship: Crafted with precision, this brass Shankh showcases the skillful craftsmanship that went into its creation. The Vishnu imprint captures the essence of divinity and grace, enhancing both its spiritual and aesthetic value. Sacred Sound: When blown, the Shankh produces a melodious and purifying sound, invoking a sense of tranquility and sanctity. It is traditionally used in Hindu rituals and ceremonies to announce the beginning of worship and to create a sacred atmosphere. Versatile Use: This brass Shankh serves both spiritual and decorative purposes. Display it as a stunning decor piece in your home, office, or temple, or use it during your spiritual practices and rituals to infuse your surroundings with divine energy. Compact and Portable: Despite its profound spiritual significance, this Shankh is compact and portable, allowing you to carry the blessings of Lord Vishnu wherever you go and enhancing your spiritual journey. The “Brass Shankh with Vishnu Imprint and Divine Sound” is a conduit that bridges the earthly and the divine. It invites you to embrace the transformative power of sound and spirituality, making it a cherished addition to your spiritual practices and a symbol of reverence in your sacred space.",https://i0.wp.com/theartofbrass.com/wp-content/uploads/2023/09/TAOB-42.jpg?fit=416%2C589&ssl=1,https://theartofbrass.com/product/brass-shankh-with-vishnu-imprint-and-divine-sound/
Divine Balance: Lord Ganesha and Goddess Lakshmi Brass Idol Pair,₹ 375,"Tags: laxmi, Lord Ganesha","Experience the harmonious convergence of blessings and prosperity with the “Divine Balance: Lord Ganesha and Goddess Lakshmi Brass Idol Pair.” Meticulously crafted, this set encapsulates the divine synergy between Lord Ganesha, the remover of obstacles, and Goddess Lakshmi, the bestower of wealth and abundance. Product Highlights: Invite the blessings of Lord Ganesha and Goddess Lakshmi into your life with the “Divine Balance: Lord Ganesha and Goddess Lakshmi Brass Idol Pair.” This remarkable creation captures their combined divine grace, filling your space with positivity and prosperity.",https://i0.wp.com/theartofbrass.com/wp-content/uploads/2023/08/TAOB-12.jpg?fit=416%2C589&ssl=1,https://theartofbrass.com/product/divine-balance-lord-ganesha-and-goddess-lakshmi-brass-idol-pair/
Divine Duo: Brass Ganesh & Lakshmi Idol Set – Miniature,₹ 900,"Tags: ganesha, Goddess Laxmi, lakshmi, laxmi, Lord Ganesha","Discover the celestial companionship of Lord Ganesh and Goddess Lakshmi with this exquisite miniature brass idol set. Meticulously crafted with intricate details, this set encapsulates their divine connection in a compact form. The Ganesh idol features his iconic elephant head and tranquil presence, while Lakshmi emanates beauty and prosperity. Perfect for smaller spaces or as a thoughtful gift. Weight: Approximately 700 grams.",https://i0.wp.com/theartofbrass.com/wp-content/uploads/2023/08/TAOB-20.jpg?fit=416%2C589&ssl=1,https://theartofbrass.com/product/divine-duo-brass-ganesh-lakshmi-idol-set-miniature/
Divine Duo: Brass Ganesh & Lakshmi Idol Set – Miniature 2,₹ 875,"Tags: ganesha, Goddess Laxmi, lakshmi, laxmi, Lord Ganesha","Discover the celestial companionship of Lord Ganesh and Goddess Lakshmi with this exquisite miniature brass idol set. Meticulously crafted with intricate details, this set encapsulates their divine connection in a compact form. The Ganesh idol features his iconic elephant head and tranquil presence, while Lakshmi emanates beauty and prosperity. Perfect for smaller spaces or as a thoughtful gift. Weight: Approximately 700 grams.",https://i0.wp.com/theartofbrass.com/wp-content/uploads/2023/08/TAOB-23.jpg?fit=416%2C589&ssl=1,https://theartofbrass.com/product/divine-duo-brass-ganesh-lakshmi-idol-set-miniature-2/
Divine Harmony: Lord Ganesha and Goddess Lakshmi Brass Idol Pair,₹ 250,"Tags: ganesha, laxmi, Lord Ganesha","Experience the harmonious convergence of blessings and prosperity with the “Divine Harmony: Lord Ganesha and Goddess Lakshmi Brass Idol Pair.” This meticulously crafted set encapsulates the divine synergy between Lord Ganesha and Goddess Lakshmi, now with added weight of 200gms and standing at a majestic height of 3 inches. Product Highlights: Invite the blessings of Lord Ganesha and Goddess Lakshmi into your life with the enhanced “Divine Harmony: Lord Ganesha and Goddess Lakshmi Brass Idol Pair.” This remarkable creation, now with increased weight and stature, captures not only their individual magnificence but also their combined divine grace, filling your space with positivity and prosperity.",https://i0.wp.com/theartofbrass.com/wp-content/uploads/2023/08/TAOB-13.jpg?fit=416%2C589&ssl=1,https://theartofbrass.com/product/divine-harmony-lord-ganesha-and-goddess-lakshmi-brass-idol-pair/
Divine Harmony: Lord Ganesha and Goddess Lakshmi Brass Idol Pair – Enhanced Version,₹ 250,"Tags: laxmi, Lord Ganesha","Experience an even more captivating rendition of blessings and prosperity with the “Divine Harmony: Lord Ganesha and Goddess Lakshmi Brass Idol Pair – Enhanced Version.” This meticulously crafted set has been regenerated to embody the perfect balance of divine energies. Now weighing 200gms and standing at a height of 3 inches, this pair encapsulates the synergy between Lord Ganesha, the remover of obstacles, and Goddess Lakshmi, the bestower of wealth and abundance. Product Highlights: Experience the intensified blessings of Lord Ganesha and Goddess Lakshmi with the “Divine Harmony: Lord Ganesha and Goddess Lakshmi Brass Idol Pair – Enhanced Version.” This reinvigorated masterpiece symbolizes their united grace and ensures that their divine energies touch your life in profound ways.",https://i0.wp.com/theartofbrass.com/wp-content/uploads/2023/08/TAOB-11.jpg?fit=416%2C589&ssl=1,https://theartofbrass.com/product/divine-harmony-lord-ganesha-and-goddess-lakshmi-brass-idol-pair-enhanced-version/
"Divine Harmony: Ram, Laxman, Sita, and Hanuman Brass Idol Set","₹ 7,500","Tags: Hanuman, Laxman, Ram, Sita",,https://i0.wp.com/theartofbrass.com/wp-content/uploads/2023/08/TAOB-8.jpg?fit=416%2C589&ssl=1,https://theartofbrass.com/product/divine-harmony-ram-laxman-sita-and-hanuman-brass-idol-set/
Divine Harmony: The Sacred Brass Vessel with Lord Ganesha and Mushak Raj Imprints,"₹ 1,250",Tag: Lord Ganesha,,https://i0.wp.com/theartofbrass.com/wp-content/uploads/2023/07/TAOB-4.jpg?fit=416%2C589&ssl=1,https://theartofbrass.com/product/brass-vessel-with-lord-ganesha-and-mushak-raj-imprints/
Divine Prosperity: The Silver-Coated Brass Idol of Lord Ganesha and Goddess Laxmi,"₹ 1,500","Tags: ganesha, laxmi",,https://i0.wp.com/theartofbrass.com/wp-content/uploads/2023/07/TAOB-1.jpg?fit=416%2C589&ssl=1,https://theartofbrass.com/product/idol-of-lord-ganesha-and-goddess-laxmi/
Divine Shiv Ji Brass Idol,"₹ 1,875","Tags: Lord Shiva, Shiv Ji","Elevate your spiritual space with the exquisite “Divine Shiv Ji Brass Idol.” This beautifully crafted brass sculpture captures the divine essence of Lord Shiva in every detail. With a substantial weight of 1.5 kg and standing at approximately 7 inches in height, this idol exudes a sense of grandeur and presence that will enhance your home altar, meditation room, or sacred space. Crafted by skilled artisans, this brass idol portrays Lord Shiva in a traditional and reverential form. His serene countenance, the graceful flow of his hair, the iconic third eye, and the sacred snake coiled around his neck are all intricately designed to perfection. The fine craftsmanship and attention to detail make it a cherished piece for both worship and decoration. Invite the divine energy and blessings of Lord Shiva into your life with this magnificent brass idol. Whether you seek a centerpiece for your spiritual practices or a stunning piece of art to grace your living space, the “Divine Shiv Ji Brass Idol” is a symbol of grace, strength, and transcendence. Bring home this symbol of devotion and spirituality today and let the presence of Lord Shiva fill your surroundings with peace and serenity.",https://i0.wp.com/theartofbrass.com/wp-content/uploads/2023/09/TAOB-26-1.jpg?fit=416%2C589&ssl=1,https://theartofbrass.com/product/divine-shiv-ji-brass-idol/
"Divine Trinity: Lord Shiva Enthroned with Nandi, Parvati, and Kartikeya","₹ 4,199","Tags: Kartikeya, Lord Ganesha, Lord Shiva, Nandi, Parvati, Shivpariwar","Behold the divine presence of Lord Shiva, seated regally upon his sacred mount, Nandi, in the company of the serene Goddess Parvati and the valorous Lord Kartikeya. This exquisite brass idol, weighing 3.3 kilograms and standing at a height of 8 inches, showcases the remarkable craftsmanship and devotion that brings the holy trinity to life. Crafted with meticulous attention to detail, this piece captures the spiritual essence and grace of the divine family, making it a cherished addition to your sacred space or a meaningful gift for a loved one. Invite the blessings and protection of Lord Shiva into your life with this beautifully crafted masterpiece.",https://i0.wp.com/theartofbrass.com/wp-content/uploads/2023/09/TAOB-46.jpg?fit=416%2C589&ssl=1,https://theartofbrass.com/product/divine-trinity-lord-shiva-enthroned-with-nandi-parvati-and-kartikeya/
"Divine Trio: Lord Ram, Sita, and Laxman Brass Idols",₹ 900,"Tags: Laxman, Ram, Sita",,https://i0.wp.com/theartofbrass.com/wp-content/uploads/2023/08/TAOB-7.jpg?fit=416%2C589&ssl=1,https://theartofbrass.com/product/divine-trio-lord-ram-sita-and-laxman-brass-idols/
Divine Unity: Lord Ganesha and Goddess Lakshmi Brass Idol Pair,₹ 400,,"Experience the harmonious convergence of blessings and prosperity with the “Divine Unity: Lord Ganesha and Goddess Lakshmi Brass Idol Pair.” Now regenerated with enhanced weight and standing at a majestic 3 inches tall, this meticulously crafted set encapsulates the divine synergy between Lord Ganesha, the remover of obstacles, and Goddess Lakshmi, the bestower of wealth and abundance. Product Highlights: Invite the blessings of Lord Ganesha and Goddess Lakshmi into your life with the “Divine Unity: Lord Ganesha and Goddess Lakshmi Brass Idol Pair.” This remarkable creation, now with enhanced weight and height, captures not only their individual magnificence but also their combined divine grace, filling your space with positivity and prosperity.",https://i0.wp.com/theartofbrass.com/wp-content/uploads/2023/08/TAOB-10.jpg?fit=416%2C589&ssl=1,https://theartofbrass.com/product/divine-unity-lord-ganesha-and-goddess-lakshmi-brass-idol-pair/
DivineAura Brass Tirupati Balaji Shankh Chakra Namah Plate,"₹ 1,200","Tags: Balaji, Hanuman, Shanku Namah Chakra","Introducing the DivineAura Brass Tirupati Balaji Shankh Chakra Namah Plate – a harmonious blend of spirituality and artistry. This exquisitely crafted brass plate pays homage to the revered deity, Lord Tirupati Balaji, encapsulating his divine blessings within a work of art. Weighing a substantial 800 grams, this plate showcases meticulous craftsmanship that radiates reverence and grace. With a diameter of 10 inches, it commands attention and reverence in any sacred space. The intricate design, featuring the iconic Shankh (conch shell) and Chakra (discus) symbols, is an embodiment of Lord Tirupati Balaji’s eternal presence. The plate serves as a sacred focal point for your prayers and meditation, inviting positive energies into your surroundings. Whether placed in your home temple, meditation room, or altar, the DivineAura Brass Tirupati Balaji Shankh Chakra Namah Plate acts as a conduit for spiritual connection and introspection. Elevate your spiritual practice with this embodiment of devotion and artistry. Let the presence of Lord Tirupati Balaji grace your space, as you embark on a journey of self-discovery and tranquility.",https://i0.wp.com/theartofbrass.com/wp-content/uploads/2023/08/TAOB-2.jpg?fit=416%2C589&ssl=1,https://theartofbrass.com/product/divineaura-brass-tirupati-balaji-shankh-chakra-namah-plate/
Eternal Harmony: Large Brass Ganesh & Lakshmi Sculpture,"₹ 3,750","Tags: ganesha, Goddess Laxmi, lakshmi, laxmi, Lord Ganesha","Immerse yourself in the eternal harmony and grace of this large brass sculpture featuring Lord Ganesh and Goddess Lakshmi. With substantial weight and impeccable artistry, this piece becomes the focal point of any room, radiating devotion and tranquility. The intricate design and craftsmanship reflect their divine attributes in remarkable detail. Weight: About 3 kilograms.",https://i0.wp.com/theartofbrass.com/wp-content/uploads/2023/08/TAOB-21.jpg?fit=416%2C589&ssl=1,https://theartofbrass.com/product/eternal-harmony-large-brass-ganesh-lakshmi-sculpture/
