Title,Price,Tags,Description,Image URL,Source URL
Sacred Dhanvantari Brass Idol for Health and Wellness,"₹ 1,500",Tag: Dhanvantari,"Invite the divine blessings of Lord Dhanvantari into your life with the “Sacred Dhanvantari Brass Idol for Health and Wellness.” This meticulously crafted brass idol, standing at approximately 7 inches in height and weighing 1.2 kg, embodies the spirit of health, healing, and well-being. Key Features: Lord of Healing: Lord Dhanvantari is revered as the deity of Ayurveda, the ancient system of natural healing. Placing this sacred idol in your home or healing space is a symbol of your dedication to health and holistic wellness. Exquisite Craftsmanship: Each detail of this brass idol is a testament to the skilled craftsmanship that went into its creation. From Lord Dhanvantari’s serene countenance to the flowing robes, every aspect reflects the essence of divinity and healing. Perfect Size and Weight: Measuring 7 inches in height and weighing 1.2 kg, this idol is perfectly sized to grace your home altar, meditation area, or wellness sanctuary. Its substantial weight ensures stability and presence. Spiritual Significance: Whether you are a practitioner of Ayurveda, a healthcare professional, or simply seeking blessings for good health, this idol serves as a focal point for your prayers, meditation, and spiritual practices. Versatile Placement: The timeless design of this brass idol seamlessly fits into various decor styles. It can be prominently displayed in your living space, office, clinic, or yoga studio, radiating an aura of tranquility and healing energy. Embrace the ancient wisdom of Ayurveda and the blessings of Lord Dhanvantari with the “Sacred Dhanvantari Brass Idol for Health and Wellness.” As you welcome this divine presence into your life, may it bring you the healing energies and holistic well-being that you seek",https://i0.wp.com/theartofbrass.com/wp-content/uploads/2023/09/TAOB-33.jpg?fit=416%2C589&ssl=1,https://theartofbrass.com/product/sacred-dhanvantari-brass-idol-for-health-and-wellness/
Sacred Embrace: Small Brass Ganesh & Lakshmi Statue,"₹ 1,000","Tags: Goddess Laxmi, lakshmi, Lord Ganesha","Witness the eternal bond between Lord Ganesh and Goddess Lakshmi with this small brass statue. The intricately designed idols depict them in a sacred embrace, symbolizing their unwavering love and unity. The compact size makes it an ideal addition to your home altar or a meaningful present for a loved one. Weight: Around 800 grams.",https://i0.wp.com/theartofbrass.com/wp-content/uploads/2023/08/TAOB-17.jpg?fit=416%2C589&ssl=1,https://theartofbrass.com/product/sacred-embrace-small-brass-ganesh-lakshmi-statue/
SacredAura Brass Shanku Namah Chakra Plate,"₹ 1,200",,"Experience the divine resonance with the SacredAura Brass Shanku Namah Chakra Plate – a masterpiece that embodies spiritual devotion and artistic brilliance. Crafted meticulously in brass, this plate reverently integrates the Shanku (conch) and Chakra (discus) symbols, creating a sacred emblem of cosmic balance and protection. Weighing a harmonious 800 grams and measuring 10 inches in diameter, this plate holds a significant presence in any sacred space. The intricate design is a testament to the timeless traditions, exuding a sense of tranquility and divine connection. Elevate your spiritual practices as the SacredAura Brass Shanku Namah Chakra Plate becomes a conduit for your prayers, meditation, and introspection. Invite the energies of Lord Vishnu’s divine weapons into your home, allowing their symbolism to guide you on a path of enlightenment and spiritual growth. Embrace the balance of artistic elegance and profound spirituality with this remarkable creation. Let the presence of the SacredAura Brass Shanku Namah Chakra Plate enrich your space and infuse your journey with blessings and serenity. ",https://i0.wp.com/theartofbrass.com/wp-content/uploads/2023/08/TAOB-3.jpg?fit=416%2C589&ssl=1,https://theartofbrass.com/product/sacredaura-brass-shanku-namah-chakra-plate/
SacredAura: Goddess Durga Brass Idol,₹ 600,Tag: Durga,"Elevate your spiritual space with the timeless elegance of the “SacredAura: Goddess Durga Brass Idol.” Immerse yourself in the divine presence of Goddess Durga, beautifully captured in intricate brass craftsmanship. Product Highlights: Infuse your surroundings with the divine energy and unwavering strength of Goddess Durga. The “SacredAura: Goddess Durga Brass Idol” is more than a mere art piece – it’s a bridge between the earthly and the divine, a conduit for blessings and inspiration.",https://i0.wp.com/theartofbrass.com/wp-content/uploads/2023/08/TAOB-9.jpg?fit=416%2C589&ssl=1,https://theartofbrass.com/product/sacredaura-goddess-durga-brass-idol/
Shivparivar Brass Idol Set – Complete Family,"₹ 12,500","Tags: Lord Ganesha, Lord Shiva","This extraordinary ensemble features finely crafted brass idols representing the entire divine family of Lord Shiva, each standing approximately 12 inches tall, collectively weighing 10 kg. In this set, you will find the divine members of the Shiva Parivar, including Lord Shiva himself, the mighty Lord Shiva, the serene Goddess Parvati, the beloved Lord Ganesha, and the graceful Goddess Saraswati. Each idol is a masterpiece of craftsmanship, meticulously detailed to capture the unique attributes and expressions of these revered deities. The weight and size of these brass idols command attention and admiration. They are perfect for adorning your home altar, temple, or sacred space, creating a spiritually charged ambiance. Whether you seek blessings, seek inspiration, or simply appreciate the artistry, this complete family set embodies the essence of devotion, strength, wisdom, and harmony. Crafted by skilled artisans, this “Shivparivar Brass Idol Set – Complete Family” is a symbol of your devotion and reverence to the divine. It not only enriches your spiritual practices but also adds a touch of timeless elegance to your home decor. Invite the divine presence of the Shiva Parivar into your life with this exceptional brass idol set. Create an atmosphere of divinity and auspiciousness, making every moment in your sacred space a profound and uplifting experience.",https://i0.wp.com/theartofbrass.com/wp-content/uploads/2023/09/TAOB-27.jpg?fit=416%2C589&ssl=1,https://theartofbrass.com/product/shivparivar-brass-idol-set-complete-family/
Shri Panchmukhi Hanuman,"₹ 5,000",Tag: Hanuman,,https://i0.wp.com/theartofbrass.com/wp-content/uploads/2023/08/TAOB-6.jpg?fit=416%2C589&ssl=1,https://theartofbrass.com/product/shri-panchmukhi-hanuman/
Shri Panchmukhi Hanuman in Seated Meditation Pose: Divine Brass Sculpture,"₹ 1,050","Tags: Hanuman, Panchmukhi Hanuman","Discover the divine energy of Shri Panchmukhi Hanuman in this exquisite brass sculpture, weighing 840 grams and standing at a height of 4 inches. In this captivating representation, Lord Hanuman is depicted in a seated meditation pose, radiating a serene and powerful presence. Crafted with meticulous attention to detail, this sculpture captures the essence of Lord Hanuman’s multi-faceted attributes and his deep spiritual connection. With intricate artistry and a profound aura, it serves as a symbol of strength, devotion, and inner peace. Whether placed in your sacred space or gifted to a devotee, this sculpture embodies the divine grace of Shri Panchmukhi Hanuman, providing inspiration and blessings to all who behold it",https://i0.wp.com/theartofbrass.com/wp-content/uploads/2023/09/TAOB-55.jpg?fit=416%2C589&ssl=1,https://theartofbrass.com/product/shri-panchmukhi-hanuman-in-seated-meditation-pose-divine-brass-sculpture/
Standing Shri Vishnu Ji Idol with Four Hands and Divine Weapon (Sashtra): Exquisite Brass Sculpture,"₹ 1,550",Tag: Lord Vishnu,"Embrace the divine presence with this exquisite Standing Shri Vishnu Ji Idol, graced with four hands, and holding a divine weapon (Shastra). This meticulously crafted brass sculpture weighs 1.220 kilograms and stands at an impressive height of 7.5 inches. The idol depicts Lord Vishnu in his standing posture, radiating a sense of grace and power. His four hands symbolize his ability to protect and preserve the universe. The divine weapon, or Shastra, held in one of his hands, signifies his role as the protector of righteousness and dharma. Crafted with remarkable attention to detail, this sculpture captures the essence of Lord Vishnu’s divine attributes. It is not only a symbol of faith and devotion but also a stunning piece of artistry that enhances any sacred space or home altar. Invite the blessings and protection of Lord Vishnu into your life with this beautifully crafted masterpiece.",https://i0.wp.com/theartofbrass.com/wp-content/uploads/2023/09/TAOB-56.jpg?fit=416%2C589&ssl=1,https://theartofbrass.com/product/standing-shri-vishnu-ji-idol-with-four-hands-and-divine-weapon-sashtra-exquisite-brass-sculpture/
Swing Chain Hook – Georgean Type Jhoola Chain Hanger,₹ 225,Tag: Jhoola Chain,"Enhance your divine experience with the “Jhoola Chain Hook,” a meticulously crafted brass chain hanger designed specifically for your jhoola (swing). Each hook is not only a functional piece but also a beautiful representation of devotion, ensuring the safe and secure hanging of your sacred swing.",https://i0.wp.com/theartofbrass.com/wp-content/uploads/2023/09/TAOB-29.jpg?fit=416%2C589&ssl=1,https://theartofbrass.com/product/swing-chain-hook-georgean-type-jhoola-chain-hanger/
Swing Chain Hook – Jhoola Chain Hanger,₹ 275,Tag: Jhoola Chain,"Enhance your divine experience with the “Jhoola Chain Hook,” a meticulously crafted brass chain hanger designed specifically for your jhoola (swing). Each hook is not only a functional piece but also a beautiful representation of devotion, ensuring the safe and secure hanging of your sacred swing.",https://i0.wp.com/theartofbrass.com/wp-content/uploads/2023/09/TAOB-28.jpg?fit=416%2C589&ssl=1,https://theartofbrass.com/product/swing-chain-hook-jhoola-chain-hanger/
Swing Chain Hook – Jhoola Chain Hanger Collection,₹ 765,Tag: Jhoola Chain,"Enhance your divine experience with the “Jhoola Chain Hanger Collection” a meticulously crafted brass chain hanger designed specifically for your jhoola (swing). Each hook is not only a functional piece but also a beautiful representation of devotion, ensuring the safe and secure hanging of your sacred swing.",https://i0.wp.com/theartofbrass.com/wp-content/uploads/2023/09/TAOB-32.jpg?fit=416%2C589&ssl=1,https://theartofbrass.com/product/swing-chain-hook-jhoola-chain-hanger-collection/
Swing Chain Hook – Peacock Jhoola Chain Hanger,₹ 200,Tag: Jhoola Chain,"Enhance your divine experience with the “Jhoola Chain Hook,” a meticulously crafted brass chain hanger designed specifically for your jhoola (swing). Each hook is not only a functional piece but also a beautiful representation of devotion, ensuring the safe and secure hanging of your sacred swing.",https://i0.wp.com/theartofbrass.com/wp-content/uploads/2023/09/TAOB-30.jpg?fit=416%2C589&ssl=1,https://theartofbrass.com/product/swing-chain-hook-peacock-jhoola-chain-hanger/
Swing Chain Hook – Small Georgean Type Jhoola Chain Hanger,₹ 90,Tag: Jhoola Chain,"Enhance your divine experience with the “Jhoola Chain Hook,” a meticulously crafted brass chain hanger designed specifically for your jhoola (swing). Each hook is not only a functional piece but also a beautiful representation of devotion, ensuring the safe and secure hanging of your sacred swing.",https://i0.wp.com/theartofbrass.com/wp-content/uploads/2023/09/TAOB-31.jpg?fit=416%2C589&ssl=1,https://theartofbrass.com/product/swing-chain-hook-small-georgean-type-jhoola-chain-hanger/
The Sacred Brass Vessel with Peacock feather design,"₹ 1,250",,,https://i0.wp.com/theartofbrass.com/wp-content/uploads/2023/08/TAOB-5.jpg?fit=416%2C589&ssl=1,https://theartofbrass.com/product/the-sacred-brass-vessel-with-peacock-feather-design/
Umiya Maa: Graceful Brass Goddess Statue,"₹ 1,750",Tag: Umiya Maa,"Introducing the “Umiya Maa: Graceful Brass Goddess Statue,” a stunning representation of divine femininity and grace. This intricately crafted brass statue captures the essence of the goddess in all her splendor. With meticulous attention to detail, this statue portrays the goddess exuding an aura of serenity and strength. The flowing contours of her form and the delicate features on her face reflect her divine nature, embodying both maternal care and powerful energy. Weighing 1.4 kilograms, this statue boasts substantial weight, emphasizing its quality craftsmanship and durability. Whether placed as a centerpiece on your altar, as part of your home decor, or gifted to a loved one, the “Umiya Maa: Graceful Brass Goddess Statue” radiates an aura of positivity and spiritual energy. Let the presence of this divine goddess infuse your surroundings with her blessings and protection. Embrace the elegance and symbolism that this statue brings, celebrating the timeless spirit of femininity and the divine feminine archetype.",https://i0.wp.com/theartofbrass.com/wp-content/uploads/2023/08/TAOB-25.jpg?fit=416%2C589&ssl=1,https://theartofbrass.com/product/umiya-maa-graceful-brass-goddess-statue/
Vishnu Brass Idol Resting on Sheshnag with Goddess Lakshmi: Divine Sculpture,₹ 950,"Tags: lakshmi, Lord Vishnu, Sheshnag","Experience divine tranquility with this elegant Vishnu Brass Idol, weighing 740 grams and measuring 4 inches in height. In this exquisite portrayal, Lord Vishnu is depicted reclining comfortably on the divine serpent, Sheshnag, with the graceful presence of Goddess Lakshmi by his side. Crafted with meticulous attention to detail, this sculpture captures the essence of Lord Vishnu’s divine attributes as the preserver of the universe and Goddess Lakshmi as the embodiment of wealth and prosperity. This beautiful brass idol is a harmonious addition to your sacred space or home decor, inviting blessings and serenity into your life. Its intricate craftsmanship and serene aura make it a cherished centerpiece for your altar or a thoughtful gift for loved ones seeking spiritual and aesthetic enrichment.",https://i0.wp.com/theartofbrass.com/wp-content/uploads/2023/09/TAOB-57.jpg?fit=416%2C589&ssl=1,https://theartofbrass.com/product/vishnu-brass-idol-resting-on-sheshnag-with-goddess-lakshmi-divine-sculpture/
Wealthy Blessings: Brass Goddess Lakshmi Idol Seated on Lotus of Prosperity,"₹ 5,000","Tags: Goddess Laxmi, laxmi","Introducing the “Wealthy Blessings” Brass Idol of Goddess Lakshmi, gracefully seated upon a lotus of prosperity and surrounded by the essence of wealth. This exquisite creation stands as a symbol of abundance and blessings, destined to enhance the ambiance of your space with its divine presence. Weighing a substantial 4 kilograms, this meticulously crafted brass idol commands attention and reverence. With dimensions of 11 inches in height, it captures the goddess’s beauty and benevolence in remarkable detail. Goddess Lakshmi, the epitome of fortune and affluence, is portrayed in this idol exuding elegance and grace. Her serene countenance and the lotus she sits upon symbolize purity, growth, and transcendence. What sets this idol apart is the golden cascade of coins that surround the lotus base, signifying the showering of wealth and prosperity. Handcrafted with precision, this brass idol not only adorns your living space with its exquisite craftsmanship but also radiates the energy of abundance. Whether displayed in your home, workplace, or meditation corner, the “Wealthy Blessings” Brass Idol of Goddess Lakshmi serves as a reminder of the blessings and affluence that flow through life. Invite the goddess’s blessings and prosperity into your life by welcoming this divine creation into your space. The idol’s presence is sure to uplift your spirits and infuse your surroundings with the positive energy of wealth and well-being.",https://i0.wp.com/theartofbrass.com/wp-content/uploads/2023/08/TAOB-16.jpg?fit=416%2C589&ssl=1,https://theartofbrass.com/product/wealthy-blessings-brass-goddess-lakshmi-idol-seated-on-lotus-of-prosperity/
