Title,Price,Tags,Description,Image URL,Source URL
Exquisite Brass Ganesh Idol with Traditional Pagadi,"₹ 16,250",Tag: Lord Ganesha,"Elevate your spiritual space with our Exquisite Brass Ganesh Idol adorned with a Traditional Pagadi. Crafted with meticulous attention to detail, this splendid idol stands 17 inches tall, making it a captivating centerpiece for your home, office, or sacred altar. Meticulously cast in high-quality brass, this Ganesh idol carries an air of timeless elegance. The intricate craftsmanship brings out the fine features of Lord Ganesha, depicting his divine presence in a truly mesmerizing form. The addition of the Traditional Pagadi, a symbol of respect and honor, adds an authentic touch to the idol’s appearance. Weighing an impressive 13 kg, this brass Ganesh idol exudes a substantial presence, symbolizing the strength and grace that Lord Ganesha represents. Its size and weight contribute to its profound aura, making it an ideal choice for those seeking to create an atmosphere of reverence and devotion. Whether as a cherished addition to your personal collection or a thoughtful gift for a loved one, the Exquisite Brass Ganesh Idol with Traditional Pagadi is a symbol of auspicious beginnings, wisdom, and prosperity. Invite the blessings of Lord Ganesha into your life and surroundings with this remarkable piece of artistry.",https://i0.wp.com/theartofbrass.com/wp-content/uploads/2023/08/TAOB-14.jpg?fit=416%2C589&ssl=1,https://theartofbrass.com/product/exquisite-brass-ganesh-idol-with-traditional-pagadi/
Exquisitely Crafted Antique Brass Idol Set Featuring Lakshmi and Ganesh,"₹ 6,000","Tags: Goddess Laxmi, Lord Ganesha","Immerse your sacred space in the timeless elegance and divine blessings of Lord Ganesh and Goddess Lakshmi with the “Exquisitely Crafted Antique Brass Idol Set Featuring Lakshmi and Ganesh.” This meticulously crafted pair of antique brass idols, with a combined weight of 4 kg and each idol standing at approximately 8 inches in height, is a symbol of artistry, spirituality, and enduring grace. Key Features: Antique Splendor: Crafted with meticulous attention to detail, these brass idols radiate a sense of classical grandeur. Their antique finish imparts an air of vintage opulence to your sacred environment. Divine Pair: This set encompasses both Lord Ganesh and Goddess Lakshmi, symbolizing the remover of obstacles and the bestower of wealth and prosperity. Their collective presence is believed to usher in blessings, success, and abundance to your living space. Masterful Craftsmanship: Every facet of these idols reflects the craftsmanship and devotion poured into their creation. From Lord Ganesh’s divine attributes to Goddess Lakshmi’s serene benevolence, each detail is a testament to artistry and faith. Perfect Size and Weight: With a height of approximately 8 inches and a combined weight of 4 kg, these idols command attention and stability in your sacred sanctuary. They serve as a focal point for your prayers and spiritual devotion. Spiritual Significance: Whether you are a devoted seeker of blessings or simply appreciate the symbolism of prosperity and wisdom, these idols inspire deep reverence and contemplation. Versatile Display: The classic design of these brass idols complements a variety of decor styles. They can grace your home, office, or temple, creating an ambiance imbued with divine presence and abundance. Embrace the enduring beauty and spiritual significance of the “Exquisitely Crafted Antique Brass Idol Set Featuring Lakshmi and Ganesh.” As you welcome these sacred representations into your life, may they envelop your surroundings in blessings, prosperity, and timeless grace.",https://i0.wp.com/theartofbrass.com/wp-content/uploads/2023/09/TAOB-38.jpg?fit=416%2C589&ssl=1,https://theartofbrass.com/product/exquisitely-crafted-antique-brass-idol-set-featuring-lakshmi-and-ganesh/
Garun Ghanti Brass Pooja Bell,₹ 350,"Tags: Ghanti, Pooja Bell","Elevate your spiritual rituals and bring an aura of sanctity to your sacred space with the “Garun Ghanti Brass Pooja Bell.” This beautifully crafted brass bell, weighing 250g and standing at a height of 5.5 inches, is a harmonious blend of tradition, artistry, and devotion. Key Features: Divine Sound: The Garun Ghanti (Pooja Bell) is meticulously designed to produce a pure, resonating sound when rung. Its melodious chime is believed to ward off negative energies and invoke positive vibrations during prayers and rituals. Artisanal Craftsmanship: Crafted with precision, this brass bell showcases the skilled craftsmanship that went into its creation. The intricate details and traditional design make it a stunning addition to your Pooja room or altar. Perfect Weight and Size: Weighing 250g and standing at 5.5 inches, this bell is thoughtfully designed for ease of use and handling during your spiritual practices. It is neither too heavy nor too large, allowing for a comfortable grip. Spiritual Significance: The ringing of a Pooja bell is a significant ritual in Hinduism. It is believed to purify the environment, summon divine blessings, and announce the start of prayers or ceremonies. Versatile Use: Besides its use in Pooja rituals, this bell can also be a charming decor piece in your home or office, adding a touch of tradition and spirituality to your living space. The “Garun Ghanti Brass Pooja Bell” serves as a bridge between the earthly and the divine, enhancing your spiritual journey and creating an atmosphere of tranquility and devotion. Its enchanting sound, exquisite craftsmanship, and elegant design make it a must-have for anyone seeking to deepen their connection with the sacred.",https://i0.wp.com/theartofbrass.com/wp-content/uploads/2023/09/TAOB-40.jpg?fit=416%2C589&ssl=1,https://theartofbrass.com/product/garun-ghanti-brass-pooja-bell/
Goddess Saraswati Idol with Veena and Book in Hand: Divine Brass Sculpture,"₹ 1,250",Tag: Saraswati Maa,"Embrace the divine wisdom and artistic excellence with this exquisite Goddess Saraswati brass idol, weighing 990 grams and standing at a graceful height of 5 inches. In this captivating representation, Goddess Saraswati is depicted holding a veena (musical instrument) in one hand and a sacred book in the other. Crafted with meticulous attention to detail, this idol captures the essence of Goddess Saraswati’s blessings in the realms of knowledge, music, and the arts. With intricate artistry and a serene aura, it serves as a symbol of inspiration and creativity. Whether adorning your home altar or gifted to an admirer of the arts, this idol is a beautiful reminder of the goddess’s grace and guidance. Invite the divine presence of Goddess Saraswati into your life with this beautifully crafted masterpiece.",https://i0.wp.com/theartofbrass.com/wp-content/uploads/2023/09/TAOB-54.jpg?fit=416%2C589&ssl=1,https://theartofbrass.com/product/goddess-saraswati-idol-with-veena-and-book-in-hand-divine-brass-sculpture/
Heavenly Union: Medium-Sized Brass Ganesh & Lakshmi Figurine,"₹ 1,250","Tags: ganesha, lakshmi, laxmi, Lord Ganesha","Invoke a sense of divinity and harmony with this medium-sized brass figurine portraying the celestial union of Lord Ganesh and Goddess Lakshmi. Their presence exudes calm and spiritual connection. Every detail, from Ganesh’s playful posture to Lakshmi’s gracious expression, has been meticulously sculpted. A wonderful centerpiece for your spiritual space. Weight: Approximately 1 Kg.",https://i0.wp.com/theartofbrass.com/wp-content/uploads/2023/08/TAOB-18.jpg?fit=416%2C589&ssl=1,https://theartofbrass.com/product/heavenly-union-medium-sized-brass-ganesh-lakshmi-figurine/
Heavenly Union: Medium-Sized Brass Ganesh & Lakshmi Figurine 2,"₹ 1,300","Tags: Goddess Laxmi, lakshmi, laxmi, Lord Ganesha","Invoke a sense of divinity and harmony with this medium-sized brass figurine portraying the celestial union of Lord Ganesh and Goddess Lakshmi. Their presence exudes calm and spiritual connection. Every detail, from Ganesh’s playful posture to Lakshmi’s gracious expression, has been meticulously sculpted. A wonderful centerpiece for your spiritual space. Weight: Approximately 1 Kg.",https://i0.wp.com/theartofbrass.com/wp-content/uploads/2023/08/TAOB-19.jpg?fit=416%2C589&ssl=1,https://theartofbrass.com/product/heavenly-union-medium-sized-brass-ganesh-lakshmi-figurine-2/
Khodiyar Maa Brass Idol,"₹ 1,500",Tag: Khodiyar Maa,"Invoke the divine presence of Khodiyar Maa into your life with the “Khodiyar Maa Brass Idol.” This finely crafted brass sculpture pays homage to the revered Goddess Khodiyar, known for her strength, protection, and benevolence. Key Features: Goddess of Strength: Khodiyar Maa is venerated as a symbol of strength, courage, and maternal protection. Her presence is believed to bestow resilience and safeguard against adversity. Artistic Craftsmanship: This brass idol showcases the artistry and attention to detail that went into its creation. From Khodiyar Maa’s serene countenance to the intricate adornments, every aspect reflects the essence of divinity and grace. Divine Energy: Placing this idol in your home, temple, or sacred space is an invitation to the powerful energies of Khodiyar Maa. Many devotees seek her blessings for prosperity, well-being, and the removal of obstacles. Perfect Size: This idol is thoughtfully sized to grace your home altar, meditation area, or personal shrine. Its compact dimensions make it a versatile addition to your spiritual practices. Versatile Display: The classic design of this brass idol seamlessly fits into various decor styles. Whether placed in your living space, office, or temple, it radiates an aura of tranquility and protection. The “Khodiyar Maa Brass Idol” is a symbol of devotion and a source of strength in times of need. Embrace the divine energy of Khodiyar Maa and allow her to guide and protect you on your spiritual journey",https://i0.wp.com/theartofbrass.com/wp-content/uploads/2023/09/TAOB-41.jpg?fit=416%2C589&ssl=1,https://theartofbrass.com/product/khodiyar-maa-brass-idol/
Khodiyar Maa Brass Idol – 1.7 kg,"₹ 2,125",Tag: Khodiyar Maa,"Invoke the divine presence of Khodiyar Maa into your life with the “Khodiyar Maa Brass Idol.” This finely crafted brass sculpture pays homage to the revered Goddess Khodiyar, known for her strength, protection, and benevolence. Key Features: The “Khodiyar Maa Brass Idol” is a symbol of devotion and a source of strength in times of need. Embrace the divine energy of Khodiyar Maa and allow her to guide and protect you on your spiritual journey",https://i0.wp.com/theartofbrass.com/wp-content/uploads/2023/09/TAOB-52.jpg?fit=416%2C589&ssl=1,https://theartofbrass.com/product/khodiyar-maa-brass-idol-1-7-kg/
Large Brass Peacock Diya Oil Lamp Stand,"₹ 6,500","Tags: Deepak, Diya, Lamp, Oil Lamp",,https://i0.wp.com/theartofbrass.com/wp-content/uploads/2023/09/TAOB-45.jpg?fit=416%2C589&ssl=1,https://theartofbrass.com/product/large-brass-peacock-diya-oil-lamp-stand/
Lord  Hanuman Seated Brass Idol with Blessing Hand and Bracelet,"₹ 1,800",Tag: Hanuman,"Immerse yourself in the divine aura of Lord Hanuman with the “Hanuman Seated Brass Idol with Blessing Hand and Bracelet.” This exceptional brass idol, weighing 1.4 kg and standing at around 5 inches in height, captures the spiritual essence of Lord Hanuman’s benevolence and unwavering devotion. Key Features: Blessing Hand and Bracelet: In this captivating brass idol, Lord Hanuman is seated in a tranquil posture, extending one hand in a gesture of blessings, while in the other, he holds a sacred bracelet. This depiction radiates divine positivity, protection, and spiritual strength. Artistic Excellence: Every facet of this brass idol showcases meticulous craftsmanship. From the serene expression on Hanuman’s face to the intricate details of the bracelet, each element reverberates with devotion and artistry. Perfect Size and Weight: With a height of approximately 5 inches and a weight of 1.4 kg, this idol is designed for prominence and stability, making it an ideal centerpiece for your home altar, meditation area, or sacred shrine. Spiritual Significance: Whether you are a devout follower of Lord Hanuman seeking his blessings or drawn to the symbolism of spiritual strength and protection, this idol serves as a focal point for your prayers, meditation, and spiritual practices. Versatile Display: The timeless design of this brass idol blends seamlessly with various decor styles. It can be prominently showcased in your living space, office, temple, or any area where you desire to infuse an atmosphere of divine blessings and sacredness. Welcome the powerful presence of Lord Hanuman into your spiritual journey with the “Hanuman Seated Brass Idol with Blessing Hand and Bracelet.” As you embrace this sacred representation, may it inspire you to seek blessings, find inner strength, and navigate life’s challenges with unwavering devotion.",https://i0.wp.com/theartofbrass.com/wp-content/uploads/2023/09/TAOB-36.jpg?fit=416%2C589&ssl=1,https://theartofbrass.com/product/lord-hanuman-seated-brass-idol-with-blessing-hand-and-bracelet/
Lord Ganesh Brass Idol with Four Hands and Mushak Raj,"₹ 10,000","Tags: ganesha, Lord Ganesha, mushak","Elevate your spiritual space with the divine presence of Lord Ganesh, embodied in our “Lord Ganesh Brass Idol with Four Hands and Mushak Raj.” This intricately crafted brass idol captures the essence of Lord Ganesh’s wisdom, auspiciousness, and his revered position as the leader of Mushak Raj, the divine mouse. Key Features: Four-Handed Form: Lord Ganesh is depicted in his four-armed form, each hand holding symbolic attributes. These hands signify his multifaceted abilities, including granting blessings, dispelling obstacles, and bestowing knowledge. Mushak Raj Connection: This idol showcases Lord Ganesh seated atop his trusted mount, Mushak Raj, symbolizing his sovereignty over all beings, no matter how small or humble. Mushak Raj is an emblem of devotion and loyalty. Artistic Excellence: Crafted with meticulous attention to detail, this brass idol showcases the skillful craftsmanship that went into its creation. Every aspect, from Lord Ganesh’s serene countenance to the intricate features, reflects the essence of divinity and grace. Weight and Size: Weighing a substantial 8 kg and standing tall at 11 inches, this idol commands attention and stability in your sacred space. Its imposing presence accentuates its significance as a centerpiece for your spiritual practices. Spiritual Significance: Lord Ganesh is revered as the remover of obstacles, the patron of new beginnings, and the harbinger of good fortune. Having this idol in your sacred space is an invitation for his blessings and guidance. Versatile Display: The timeless design of this brass idol complements various decor styles. Whether placed in your home, office, or temple, it radiates an aura of auspiciousness and protection. The “Lord Ganesh Brass Idol with Four Hands and Mushak Raj” serves as a symbol of wisdom, blessings, and divine grace. Allow its presence to enrich your spiritual journey, remove obstacles from your path, and bestow auspiciousness in your life and endeavors.",https://i0.wp.com/theartofbrass.com/wp-content/uploads/2023/09/TAOB-43.jpg?fit=416%2C589&ssl=1,https://theartofbrass.com/product/lord-ganesh-brass-idol-with-four-hands-and-mushak-raj/
Lord Ganesha Holding Modak in Hand with Mushak: Divine Brass Idol,"₹ 1,000",Tag: Lord Ganesha,"Embrace the divine presence with this exquisite Lord Ganesha brass idol, weighing 800 grams and standing at a height of 5 inches. In this captivating representation, Lord Ganesha is depicted holding a modak (sweet treat) in one hand, while his loyal Mushak (mouse) accompanies him. Crafted with meticulous attention to detail, this idol captures the essence of Lord Ganesha’s benevolence and wisdom. With intricate artistry and a radiant aura, it is a symbol of prosperity and protection. Whether gracing your home altar or given as a cherished gift, this idol serves as a reminder of Lord Ganesha’s blessings and the sweetness of life. Invite his divine presence into your home with this beautifully crafted masterpiece.",https://i0.wp.com/theartofbrass.com/wp-content/uploads/2023/09/TAOB-53.jpg?fit=416%2C589&ssl=1,https://theartofbrass.com/product/lord-ganesha-holding-modak-in-hand-with-mushak-divine-brass-idol/
Lord Hanuman Seated Brass Idol with Blessing Gesture,"₹ 1,250",Tag: Hanuman,"Embrace the divine presence of Lord Hanuman with the “Hanuman Seated Brass Idol with Blessing Gesture.” This meticulously crafted brass idol, weighing 1 kg and measuring approximately 5 inches in height, encapsulates the reverence and blessings of Hanuman, making it a cherished addition to your spiritual sanctuary. Key Features: Blessing Gesture: Lord Hanuman, in this exquisite brass idol, sits in a serene posture, extending one hand in a gesture of divine blessings. This symbolic gesture radiates positivity, protection, and grace to all who seek his presence. Artistry and Craftsmanship: Every detail of this brass idol reflects the masterful craftsmanship invested in its creation. From Hanuman’s peaceful visage to the finely etched features, each element showcases the essence of devotion and benevolence. Perfect Size and Weight: With a height of approximately 5 inches and a weight of 1 kg, this idol is thoughtfully sized and weighted to grace your home altar, meditation space, or sacred shrine. Its substantial weight ensures stability and a prominent presence. Spiritual Significance: Whether you are a devout follower of Lord Hanuman seeking his blessings or wish to include this symbol of protection and grace in your spiritual practices, this idol serves as a focal point for your prayers and meditation. Versatile Display: The timeless design of this brass idol seamlessly integrates with various decor styles. It can be prominently displayed in your living space, office, temple, or any place where you intend to infuse an atmosphere of divine blessings and serenity. Invite the benevolent energy of Lord Hanuman into your life with the “Hanuman Seated Brass Idol with Blessing Gesture.” As you welcome this sacred representation into your spiritual journey, may it inspire you to receive and share blessings, protection, and boundless grace.",https://i0.wp.com/theartofbrass.com/wp-content/uploads/2023/09/TAOB-35.jpg?fit=416%2C589&ssl=1,https://theartofbrass.com/product/lord-hanuman-seated-brass-idol-with-blessing-gesture/
Mystic Devotion: Grand Brass Ganesh & Lakshmi Idol Ensemble,"₹ 3,750","Tags: ganesha, Goddess Laxmi, lakshmi, laxmi, Lord Ganesha","Celebrate the divine bond between Lord Ganesh and Goddess Lakshmi with this grand brass idol ensemble. Majestic and awe-inspiring, this masterpiece captures their mystical devotion and cosmic significance. The grandeur of the idols and their ornate adornments mirror the divine magnificence that Ganesh and Lakshmi embody. A truly remarkable addition to sacred spaces. Weight: Approximately 3 kilograms.",https://i0.wp.com/theartofbrass.com/wp-content/uploads/2023/08/TAOB-22.jpg?fit=416%2C589&ssl=1,https://theartofbrass.com/product/mystic-devotion-grand-brass-ganesh-lakshmi-idol-ensemble/
Neelkanth Varni Brass Idol,₹ 500,Tag: Neelkanth Varni,"Embrace the divine energy and serenity of Lord Neelkanth Varni with our “Neelkanth Varni Brass Idol.” This meticulously crafted brass idol, weighing 400 g and standing at 7 inches in height, encapsulates the essence of Lord Neelkanth Varni’s meditative and transformative presence. Key Features: Lord Neelkanth Varni: This brass idol beautifully portrays Lord Neelkanth Varni, an avatar of Lord Vishnu, known for his deep meditation and inner strength. His blue-throated depiction symbolizes his act of consuming poison to protect the universe. Artistic Excellence: Crafted with precision, this brass idol showcases the skillful craftsmanship that went into its creation. The intricate details, from Lord Neelkanth Varni’s serene countenance to his meditative posture, reflect the essence of divinity and grace. Weight and Size: Weighing a delicate 400 g and standing at 7 inches in height, this idol is thoughtfully designed to grace your home altar, meditation area, or personal shrine. Its modest weight allows for easy handling. Spiritual Significance: Lord Neelkanth Varni is revered for his deep spirituality and unwavering devotion. Having this idol in your sacred space is an invitation to cultivate inner strength, resilience, and serenity. Versatile Display: The classic design of this brass idol complements various decor styles. Whether placed in your living space, office, or temple, it radiates an aura of tranquility and devotion. The “Neelkanth Varni Brass Idol” serves as a reminder of the transformative power of meditation and inner strength. As you welcome this sacred representation into your life, may it inspire you to cultivate inner peace, resilience, and unwavering devotion on your spiritual journey. ",https://i0.wp.com/theartofbrass.com/wp-content/uploads/2023/09/TAOB-44-1.jpg?fit=416%2C589&ssl=1,https://theartofbrass.com/product/neelkanth-varni-brass-idol/
Radiant Brass Deepak: Illuminate Your Space with Elegance,₹ 625,"Tags: Deepak, Diya","Introducing our “Radiant Brass Deepak,” a masterpiece designed to infuse your surroundings with an enchanting glow and timeless elegance. Crafted with precision, this exquisite piece stands as a testament to the artistry of brass craftsmanship. Weighing 500 grams, the Radiant Brass Deepak is a harmonious blend of form and function. At 7 inches in size, it’s compact yet impactful, making it an ideal addition to your decor, meditation space, or sacred rituals. The deepak, or oil lamp, holds a deep-rooted significance in various cultures as a symbol of enlightenment and spiritual awakening. With its intricate detailing and mesmerizing design, this brass deepak captures the essence of this symbolism, bringing a touch of the divine into your home. Handcrafted with dedication, the Radiant Brass Deepak’s charm lies not only in its aesthetic appeal but also in its ability to create a warm and welcoming ambiance. Whether you’re seeking to enhance your meditation practice, set a tranquil mood, or simply add an aura of sophistication, this deepak is the perfect choice. Illuminate your space with the Radiant Brass Deepak and let its gentle radiance uplift your surroundings, casting a soft glow on moments of reflection and serenity.",https://i0.wp.com/theartofbrass.com/wp-content/uploads/2023/08/TAOB-15.jpg?fit=416%2C589&ssl=1,https://theartofbrass.com/product/radiant-brass-deepak-illuminate-your-space-with-elegance/
Radiant Varahi: Brass Goddess Varahi Statue,"₹ 1,000",,"Introducing the “Radiant Varahi: Brass Goddess Varahi Statue,” a mesmerizing embodiment of divine energy and strength. Crafted with precision and care, this exquisite brass statue showcases the fierce and powerful Goddess Varahi in all her glory. Standing at a proud 5 inches tall, this finely detailed statue captures every aspect of Goddess Varahi’s essence. Her commanding posture exudes confidence and fearlessness, while her distinct boar head symbolizes her unwavering determination. The intricate craftsmanship brings to life the rich symbolism and mythology associated with Varahi. Weighing 700 grams, the statue strikes a perfect balance between elegance and substance. Its compact size makes it a versatile addition to your spiritual space, whether displayed on your altar, shelf, or any area you wish to infuse with the presence of this formidable goddess. The “Radiant Varahi: Brass Goddess Varahi Statue” is more than just a decorative piece; it’s a source of inspiration, protection, and empowerment. Invite the energy of Goddess Varahi into your life and surroundings with this captivating statue, a reminder of her transformative power and fierce grace.",https://i0.wp.com/theartofbrass.com/wp-content/uploads/2023/08/TAOB-24.jpg?fit=416%2C589&ssl=1,https://theartofbrass.com/product/radiant-varahi-brass-goddess-varahi-statue/
